{
  "schema_version": 1,
  "phase": {
    "id": 51,
    "goal": "建立 descriptor 驱动的 UObject/Component 构造、Session 所有权、组件查询与 Attach/Detach C#/WASM/UE 游戏逻辑闭环",
    "start_commit": "d3837b6af995ccf289f01f9ddf4e34eec1fa319e"
  },
  "declared_stage": "implementing",
  "architecture": {
    "path": "Docs/Phase51/P51.0_Object_Component_Ownership_Architecture.md",
    "version": 1,
    "sha256": "b13d60e63cad6389db6556b254ed3755f220aef774f3fd86bfd74a88327fbda5",
    "revision_reason": "initial architecture freeze"
  },
  "documents": {
    "plan": "Docs/Phase51/P51.1_Object_Component_Ownership_Implementation_Plan.md",
    "closeout": "Docs/Phase51/P51_Phase51_Closeout.md"
  },
  "batches": [
    {
      "id": "P51.1",
      "status": "Completed",
      "evidence": "f165507: descriptor v7 object factories, immutable runtime plans, no-clean UE5.8 UBT succeeded, Automation 30/30, Prepared Semantic 13/13, clean architecture checker passed",
      "completed_at_utc": "2026-07-25T09:55:32.7605536+00:00"
    },
    {
      "id": "P51.2",
      "status": "Completed",
      "evidence": "c69cb7a: Session ownership、handle authority、generic Construct/Release/FindComponent、dynamic i64 ABI；UE5.8 no-clean VM/Bindings/Runtime 构建成功；聚焦 Automation 11/11 Success",
      "completed_at_utc": "2026-07-25T10:46:36.3370006+00:00"
    },
    {
      "id": "P51.3",
      "status": "Completed",
      "evidence": "d9c1216: typed factory/type token, generated UE facade, nominal Guest IR, packed i64 WASM; .NET 167/167; UE5.8 no-clean Editor build succeeded; focused Automation 1/1 Success; clean architecture check passed",
      "completed_at_utc": "2026-07-25T11:26:44.2580347+00:00"
    },
    {
      "id": "P51.4",
      "status": "Completed",
      "evidence": "a731f77: generic Attach/Detach bindings; 890745f: typed C# ComponentGameplay; 509017c/a5ce7ec: concrete scene factory classification and slice authorization; UE5.8 no-clean Bindings/Runtime/Editor builds succeeded; focused Automation 5/5 Success; real C# Roslyn/Guest IR/WASM BeginPlay-Tick-EndPlay loop verified with 10 crossings",
      "completed_at_utc": "2026-07-25T12:00:32.9247868+00:00"
    },
    {
      "id": "P51.5",
      "status": "Completed",
      "evidence": "完成对象类型 provenance 闭环与 fail-closed 清理；独立审查 Critical/Important/Minor 均为 0；.NET 167/167、C# BuildIntegration 15/15、PowerShell 23/23 解析、静态架构 Gate 与 17 项变异夹具全部通过；已审查并冻结 Phase 51 factory、borrowed lease 与 canonical regeneration 基线。",
      "completed_at_utc": "2026-07-25T16:23:51.4885802+00:00"
    }
  ],
  "debt": [],
  "review": {
    "completed": false,
    "evidence": "reopened: 最终 Static Gate 发现 Phase 51 factory renderer、borrowed object registry 与 canonical regeneration 的受控 Phase 50 hash/pattern 基线尚未更新；先审查真实差异并同步门禁后重新冻结",
    "completed_at_utc": null
  },
  "budgets": {
    "ubt": 3,
    "automation": 2,
    "full_gate": 2
  },
  "invocations": {
    "ubt": 0,
    "automation": 0,
    "full_gate": 0
  },
  "freeze": {
    "source_commit": "",
    "source_tree": "",
    "state_sha256": "",
    "review_evidence": "",
    "at_utc": null
  },
  "gate": {
    "report_path": "",
    "report_sha256": "",
    "run_id": "",
    "verified_commit": "",
    "verified_tree": "",
    "attestation_parent": "",
    "attested_at_utc": null
  },
  "protected_dirty": [
    {
      "path": "Docs/AvidScript_Technical_Status.md",
      "status": "??",
      "worktree_sha256": "3025ef2e274d0373168eea28a25bef6bd1a86a19e887d76ee51c6804d51698c2",
      "head_blob_sha256": ""
    },
    {
      "path": "Docs/Phase42/P42.0_Reflection_Binding_Generator_Architecture.md",
      "status": " M",
      "worktree_sha256": "569cf61960108edd6a4865da796ddf465b2ab6e6cf440dc2ae280b84f94d6655",
      "head_blob_sha256": "5881954e78c9759dafb336484adf7dcd9d064122599e9b93337c69067b08c1cf"
    },
    {
      "path": "Source/AvidScriptRuntime/Public/AvidScriptWasmReloadTypes.h",
      "status": " M",
      "worktree_sha256": "384b6e093dc8568e666dc0335b575383e473ecf00448c1d5c461a852b38edfed",
      "head_blob_sha256": "78adf726b93efd9a8736ed8152b9fd9fd293e26d2910e670d738176de0a4af49"
    }
  ],
  "next_action": "freeze -Phase 51 -ReviewEvidence <text>",
  "revision": 10,
  "updated_at_utc": "2026-07-25T16:23:51.4907681+00:00"
}
