{
  "schema_version": 1,
  "phase": {
    "id": 66,
    "goal": "完善 C# 日常语言契约与执行语义，作为结构热重载、完整调试和 Windows 真实开发闭环的基础",
    "start_commit": "c1fb477d34d489290b2ef0cbac33f2cf9151be27"
  },
  "declared_stage": "implementing",
  "architecture": {
    "path": "Docs/Phase66/P66.0_Developer_Experience_Architecture.md",
    "version": 1,
    "sha256": "eea0f24996665f2532d83d2e7c1be7b4ddb88372630594270bbb0c92ca5e401c",
    "revision_reason": "initial architecture freeze"
  },
  "documents": {
    "plan": "Docs/Phase66/P66.1_Implementation_Plan.md",
    "closeout": "Docs/Phase66/P66_Closeout.md"
  },
  "batches": [
    {
      "id": "P66.A",
      "status": "Completed",
      "evidence": "Docs/Phase66/P66.A_Lexical_Functions.md; SDK 8.0.416; Semantic 107/107; Guest 145/145; Node WASM execution 402/402; remaining batches and full Gate pending",
      "completed_at_utc": "2026-09-19T03:33:44.7911214+00:00"
    },
    {
      "id": "P66.B",
      "status": "Completed",
      "evidence": "Docs/Phase66/P66.B_Batch_Completion.md; SDK 8.0.416 Semantic 373/373 and Guest 472/472; Win64 Editor DelegateSubscription 14/14 and GeneratedTypes 11/11; generated C# body-only reload Game/PIE worlds 2/2; no-clean UBT and clean architecture at b8fdc028; P66.C/D and real Editor Play remain pending",
      "completed_at_utc": "2026-09-23T11:48:02.5875126+00:00"
    },
    {
      "id": "P66.C",
      "status": "Pending",
      "evidence": "",
      "completed_at_utc": null
    },
    {
      "id": "P66.D",
      "status": "Pending",
      "evidence": "",
      "completed_at_utc": null
    }
  ],
  "debt": [],
  "review": {
    "completed": false,
    "evidence": "",
    "completed_at_utc": null
  },
  "budgets": {
    "ubt": 3,
    "automation": 2,
    "full_gate": 2
  },
  "invocations": {
    "ubt": 0,
    "automation": 0,
    "full_gate": 0
  },
  "freeze": {
    "source_commit": "",
    "source_tree": "",
    "state_sha256": "",
    "review_evidence": "",
    "at_utc": null
  },
  "gate": {
    "report_path": "",
    "report_sha256": "",
    "run_id": "",
    "verified_commit": "",
    "verified_tree": "",
    "attestation_parent": "",
    "attested_at_utc": null
  },
  "protected_dirty": [
    {
      "path": "Benchmarks/PuertsComparison/AvidScriptPerfHarness/Tools/Invoke-Phase54GameplayBenchmark.ps1",
      "status": " M",
      "worktree_sha256": "c4166e89e8a0d084fb8fa1629828d6e851e542da8cbe447c8fc4db4d110db405",
      "head_blob_sha256": "dd5891c12aa3eb732409e3344f9087e61d610c0d9d0a9b6adfd1b3fdaf29a309"
    },
    {
      "path": "Benchmarks/PuertsComparison/Leadership/AngelScript/Scripts/Invoke-AngelScriptTiming.ps1",
      "status": " M",
      "worktree_sha256": "25a52a0498f14a16511b9b8fbc29b4f7ecc47f70db9c4d7ca66d9dffe1a87499",
      "head_blob_sha256": "bb1cd0e1171eff252a67920ef31dce0a6a5a52eef8b84e4c9225a681bfba9864"
    },
    {
      "path": "Benchmarks/PuertsComparison/Leadership/Scripts/IsolatedEditorIdentity.psm1",
      "status": "??",
      "worktree_sha256": "6ed8dd90efe413be72faf4067c20dd09ac893a70c7bb41760cced66fcdf79f0a",
      "head_blob_sha256": ""
    },
    {
      "path": "Benchmarks/PuertsComparison/Leadership/Scripts/New-IsolatedEditorIdentity.ps1",
      "status": "??",
      "worktree_sha256": "837589351bf875a9d8cbc169ed87c8137aa46810dec79f44d272b112ff070f7b",
      "head_blob_sha256": ""
    },
    {
      "path": "Docs/AvidScript_Technical_Status.md",
      "status": "??",
      "worktree_sha256": "3025ef2e274d0373168eea28a25bef6bd1a86a19e887d76ee51c6804d51698c2",
      "head_blob_sha256": ""
    },
    {
      "path": "Docs/Phase42/P42.0_Reflection_Binding_Generator_Architecture.md",
      "status": " M",
      "worktree_sha256": "569cf61960108edd6a4865da796ddf465b2ab6e6cf440dc2ae280b84f94d6655",
      "head_blob_sha256": "5881954e78c9759dafb336484adf7dcd9d064122599e9b93337c69067b08c1cf"
    },
    {
      "path": "Source/AvidScriptRuntime/Public/AvidScriptWasmReloadTypes.h",
      "status": " M",
      "worktree_sha256": "384b6e093dc8568e666dc0335b575383e473ecf00448c1d5c461a852b38edfed",
      "head_blob_sha256": "78adf726b93efd9a8736ed8152b9fd9fd293e26d2910e670d738176de0a4af49"
    }
  ],
  "next_action": "batch-complete -Phase 66 -BatchId P66.C -Evidence <text>",
  "revision": 3,
  "updated_at_utc": "2026-09-23T11:48:02.5909233+00:00"
}
