{
  "schema_version": 1,
  "phase": {
    "id": 58,
    "goal": "以统一复合值 capability 和递归 descriptor 类型图扩展 FText、递归容器、TSet/TMap、soft/weak pointer 与 delegate ref/out，保持既有热路径性能和通用生成式 UE API 架构",
    "start_commit": "ad422c1b5d0c4fe00f402083ca021b7fe6e7b4a5"
  },
  "declared_stage": "gate_attested",
  "architecture": {
    "path": "Docs/Phase58/P58.0_Universal_Value_Graph_Architecture.md",
    "version": 1,
    "sha256": "ae1fe253d1ed290d9baf43db038680a9d52783c394076cc0cf0952e0ef57da8b",
    "revision_reason": "initial architecture freeze"
  },
  "documents": {
    "plan": "Docs/Phase58/P58.0_Implementation_Plan.md",
    "closeout": "Docs/Phase58/P58_Closeout.md"
  },
  "batches": [
    {
      "id": "P58.A",
      "status": "Completed",
      "evidence": "schema19 composite heap FText soft/weak object C# composite_ref; .NET 107/107; UE5.8 no-clean build succeeded; focused Automation Identity and CompositeValues succeeded; Docs/Phase58/P58.1_Composite_Value_Core_Implementation.md",
      "completed_at_utc": "2026-08-30T08:22:29.0558869+00:00"
    },
    {
      "id": "P58.B",
      "status": "Completed",
      "evidence": "递归 TArray/TSet/TMap capability、canonical snapshot/mutation、C# facade 与 Guest lowering 已实现；AvidScript.CSharpGuest.Tests 110/110；UE5.8 no-clean Editor build Succeeded；Docs/Phase58/P58.2_Recursive_Container_Implementation.md",
      "completed_at_utc": "2026-08-30T11:15:16.9273433+00:00"
    },
    {
      "id": "P58.C",
      "status": "Completed",
      "evidence": "delegate ref/out descriptor/C# Guest/VM/Runtime transaction 已闭环；纯事件脚本 owner 修复；正式 C# direct_abi_built；Editor Automation AvidScript.Editor.CSharp.DelegateRefOut 1/1 Success；Docs/Phase58/P58.3_Delegate_RefOut_Transaction_Implementation.md",
      "completed_at_utc": "2026-08-30T11:15:25.1127026+00:00"
    },
    {
      "id": "P58.D",
      "status": "Completed",
      "evidence": "严格 Gate 产品证据保持有效：be2b0cd 上 clean architecture、UE5.8 no-clean build、253/253 .NET、119/119 PowerShell、2/2 focused 与 384/384 full Automation 通过；关闭恢复候选仅修改流程规则、lesson、P58 文档与状态，需以产品路径同一性和新 clean architecture/Harness 证据验证。",
      "completed_at_utc": "2026-08-30T15:06:00.1800816+00:00"
    }
  ],
  "debt": [
    {
      "id": "P58-D01-CompositeCapabilityAuthorization",
      "severity": "Important",
      "found_batch": "P58.D",
      "scope": "C# composite capability source-origin authorization and generated-facade compilation closure",
      "evidence": "Current CSharpCompositeValueCapabilityPolicy accepts same-shaped FAvidText/FAvidArray/FAvidSet/FAvidMap declarations from primary user source; existing Guest test deliberately lowers them without executable reference sources.",
      "deferral_reason": "Not deferred: discovered by centralized review after P58.D was marked complete and must be fixed before freeze.",
      "remediation": "Bind composite wrappers and intrinsic constructors to authorized executable reference-source provenance, reject primary-source forgeries, and compile a script against the emitted facade/package.",
      "status": "Verified",
      "resolution_evidence": "Semantic schema 17/1.19 executable-reference provenance enforced; primary-source composite wrapper forgery rejected; generated BeginPlay facade compiled through Array/Set/Map direct ABI; BuildIntegration 15/15; focused Automation 1/1 Success; full AvidScript Automation 384/384 Success; UE5.8 no-clean Editor build succeeded.",
      "target_phase": null,
      "transfer_reason": ""
    }
  ],
  "review": {
    "completed": true,
    "evidence": "关闭恢复集中复审：保留既有 Git 历史；新增 attestation allowlist lesson 与策略；P58 人读报告在冻结前定稿；恢复候选禁止修改 Source、产品 Build 与 Tests，并要求产品路径同一性、clean architecture 与 Harness audit 通过。",
    "completed_at_utc": "2026-08-30T15:08:06.5650730+00:00"
  },
  "budgets": {
    "ubt": 2,
    "automation": 2,
    "full_gate": 2
  },
  "invocations": {
    "ubt": 3,
    "automation": 4,
    "full_gate": 4
  },
  "freeze": {
    "source_commit": "c83518de5d6970d5cd024769a1f602c29e68c028",
    "source_tree": "10b5074173496398e7b6cf2cae8989540964532e",
    "state_sha256": "aaaf90c2e1dd0985189429b91beb765e9a68732f70780b31c2cd9ce69a510647",
    "review_evidence": "关闭恢复集中复审：保留既有 Git 历史；新增 attestation allowlist lesson 与策略；P58 人读报告在冻结前定稿；恢复候选禁止修改 Source、产品 Build 与 Tests，并要求产品路径同一性、clean architecture 与 Harness audit 通过。",
    "at_utc": "2026-08-30T15:08:06.5650730+00:00"
  },
  "gate": {
    "report_path": "C:\\tmp\\AvidScript\\P58Gate\\P58-f7c1518-20260830-001\\P58-Gate-Evidence.json",
    "report_sha256": "6936c12e198365b78c5d58f2534895052d4aacaf6ea2483aaa3377e5a8a2f168",
    "run_id": "P58-f7c1518-20260830-001",
    "verified_commit": "f7c151885981d7fb933c603331c5e7244d901062",
    "verified_tree": "6aa5818271b9c6e500224dfc2f52f2f6110c795d",
    "attestation_parent": "f7c151885981d7fb933c603331c5e7244d901062",
    "attested_at_utc": "2026-08-30T15:11:16.5954256+00:00"
  },
  "protected_dirty": [
    {
      "path": "Docs/AvidScript_Technical_Status.md",
      "status": "??",
      "worktree_sha256": "3025ef2e274d0373168eea28a25bef6bd1a86a19e887d76ee51c6804d51698c2",
      "head_blob_sha256": ""
    },
    {
      "path": "Docs/Phase42/P42.0_Reflection_Binding_Generator_Architecture.md",
      "status": " M",
      "worktree_sha256": "569cf61960108edd6a4865da796ddf465b2ab6e6cf440dc2ae280b84f94d6655",
      "head_blob_sha256": "5881954e78c9759dafb336484adf7dcd9d064122599e9b93337c69067b08c1cf"
    },
    {
      "path": "Docs/Phase58/P58_Closeout.md",
      "status": "??",
      "worktree_sha256": "6fb371453c80a9d7616c67f8a57c7d1a092e3796f6c7b535fed6a111ec259bc6",
      "head_blob_sha256": ""
    },
    {
      "path": "Docs/Phase58/P58.0_Implementation_Plan.md",
      "status": "??",
      "worktree_sha256": "a704e99aa050c4e1e0863cdd3f87d5f9a2d2e41de9b659331923826cb0640bd6",
      "head_blob_sha256": ""
    },
    {
      "path": "Docs/Phase58/P58.0_Universal_Value_Graph_Architecture.md",
      "status": "??",
      "worktree_sha256": "ae1fe253d1ed290d9baf43db038680a9d52783c394076cc0cf0952e0ef57da8b",
      "head_blob_sha256": ""
    },
    {
      "path": "Source/AvidScriptRuntime/Public/AvidScriptWasmReloadTypes.h",
      "status": " M",
      "worktree_sha256": "384b6e093dc8568e666dc0335b575383e473ecf00448c1d5c461a852b38edfed",
      "head_blob_sha256": "78adf726b93efd9a8736ed8152b9fd9fd293e26d2910e670d738176de0a4af49"
    }
  ],
  "next_action": "close -Phase 58",
  "revision": 13,
  "updated_at_utc": "2026-08-30T15:11:16.5981661+00:00"
}
