{
  "schema_version": 1,
  "phase": {
    "id": 59,
    "goal": "实现 C# 定义 Actor、Component、Subsystem、UCLASS/UFUNCTION/UPROPERTY、继承、覆写与 Blueprint 子类的真实 UE 类型闭环",
    "start_commit": "4018dfb3e6c19fc3ff05b5873357c5c13225ff3a"
  },
  "declared_stage": "implementing",
  "architecture": {
    "path": "Docs/Phase59/P59.1_Script_Defined_UE_Types_Architecture.md",
    "version": 4,
    "sha256": "68e8b1ca98fbee4fb6825d73cadd1ac4eb355a76fffb019c3bf1512881631f8d",
    "revision_reason": "明确 engine_name 保存 UE 反射逻辑名，A/U 语言前缀由 P59.B 生成器根据 kind 派生"
  },
  "documents": {
    "plan": "Docs/Phase59/P59.0_Implementation_Plan.md",
    "closeout": "Docs/Phase59/P59_Closeout.md"
  },
  "batches": [
    {
      "id": "P59.A",
      "status": "Completed",
      "evidence": "UE Type Declaration schema 18/1.20、canonical Roslyn projector、Guest fail-closed validator、generated facade 与 C# 示例完成；Semantic 91/91、Guest 112/112、Frontend 7/7、BuildIntegration 15/15、Prepared 13/13、SemanticCache 16/16+25/25+8/8、Publication 14/14、UE5.8 no-clean UBT 成功、focused Automation 1/1 Success。详见 Docs/Phase59/P59.A_UE_Type_Declaration_Contract.md。",
      "completed_at_utc": "2026-08-30T16:28:31.1282768+00:00"
    },
    {
      "id": "P59.B",
      "status": "Completed",
      "evidence": "完成共享合同校验、确定性 UHT shell generator、永久 AvidScriptGenerated module 与 ordinal dispatcher ABI、headless binding publication 和受控 C# semantic-to-shell 入口；真实样例生成 4 个 UE 类型；UeTypeGenerator 4/4、UE5.8 no-clean UHT/UBT 4 actions、AvidScript.GeneratedTypes.Reflection 1/1 Success；提交 4c593e5 的 clean architecture gate 通过。",
      "completed_at_utc": "2026-08-30T17:23:48.0374875+00:00"
    },
    {
      "id": "P59.C",
      "status": "Completed",
      "evidence": "commit=3ef303da01f9462432f7c9d2db3d6fa55251f974; tree=76e32067b1c1102d8e094b644d31b4688fd5217a; generated_types=3/3; runtime_generated_types=4/4; ue58_no_clean_ubt=passed; architecture=clean",
      "completed_at_utc": "2026-08-31T00:08:19.6147341+00:00"
    },
    {
      "id": "P59.D",
      "status": "Completed",
      "evidence": "P59.D1-D8 实现与 Gate instrumentation 完成；首个候选全量 Automation 发现并修复 P48 FName canonical facade fixture 漂移；fixture 与 renderer 输出逐字节一致，CSharpGuest 117/117、FName focused Automation 1/1 Success；失败候选 ac8b0f3 不作为最终证据。",
      "completed_at_utc": "2026-08-31T03:53:20.3588151+00:00"
    }
  ],
  "debt": [
    {
      "id": "P59-D01-ControlledLeadership",
      "severity": "Important",
      "found_batch": "P59.A",
      "scope": "Frozen 12-kernel LLVM AOT versus Puerts V8 p50/p95 geomean and kernel win-rate leadership gates",
      "evidence": "Inherited from P57-D06: Cranelift speed candidate p50/p95 geomean 0.9799725124/1.0005782997, p50/p95 win rates 66.67/41.67 percent, correctness failures 0, fallback false.",
      "deferral_reason": "Cranelift optimization space was exhausted without crossing the frozen 0.95 leadership gate; P59 isolates an independent LLVM AOT codegen candidate.",
      "remediation": "Evaluate WasmEdge LLVM AOT first under the unchanged 12-kernel protocol; integrate only a candidate that preserves host/artifact contracts and crosses the frozen gate, otherwise evaluate Wasmer LLVM with the same bytes and thresholds.",
      "status": "Transferred",
      "resolution_evidence": "",
      "target_phase": 65,
      "transfer_reason": "LLVM AOT 与 Puerts/AngelScript 领导力属于跨阶段发布性能门禁，不替代 P59 脚本定义 UE 类型主线；P59 热路径仍持续执行受影响 benchmark。"
    }
  ],
  "review": {
    "completed": false,
    "evidence": "reopened: 最终全量 Automation 发现 P59 新增 UClass/UProperty/UFunction facade 未同步到 P48 FName 字节 fixture；候选 ac8b0f3 作废，集中修复 fixture 漂移后重新冻结。",
    "completed_at_utc": null
  },
  "budgets": {
    "ubt": 2,
    "automation": 2,
    "full_gate": 2
  },
  "invocations": {
    "ubt": 0,
    "automation": 0,
    "full_gate": 0
  },
  "freeze": {
    "source_commit": "",
    "source_tree": "",
    "state_sha256": "",
    "review_evidence": "",
    "at_utc": null
  },
  "gate": {
    "report_path": "",
    "report_sha256": "",
    "run_id": "",
    "verified_commit": "",
    "verified_tree": "",
    "attestation_parent": "",
    "attested_at_utc": null
  },
  "protected_dirty": [
    {
      "path": "Docs/AvidScript_Technical_Status.md",
      "status": "??",
      "worktree_sha256": "3025ef2e274d0373168eea28a25bef6bd1a86a19e887d76ee51c6804d51698c2",
      "head_blob_sha256": ""
    },
    {
      "path": "Docs/Phase42/P42.0_Reflection_Binding_Generator_Architecture.md",
      "status": " M",
      "worktree_sha256": "569cf61960108edd6a4865da796ddf465b2ab6e6cf440dc2ae280b84f94d6655",
      "head_blob_sha256": "5881954e78c9759dafb336484adf7dcd9d064122599e9b93337c69067b08c1cf"
    },
    {
      "path": "Source/AvidScriptRuntime/Public/AvidScriptWasmReloadTypes.h",
      "status": " M",
      "worktree_sha256": "384b6e093dc8568e666dc0335b575383e473ecf00448c1d5c461a852b38edfed",
      "head_blob_sha256": "78adf726b93efd9a8736ed8152b9fd9fd293e26d2910e670d738176de0a4af49"
    }
  ],
  "next_action": "freeze -Phase 59 -ReviewEvidence <text>",
  "revision": 13,
  "updated_at_utc": "2026-08-31T03:53:20.3611020+00:00"
}
