{
  "schema_version": 1,
  "phase": {
    "id": 54,
    "goal": "建立可替换执行后端、WAMR AOT 闭环、多 execution lane benchmark 和通用 crossing 快路径，以同机正确性与统计证据追求领先 Puerts 与 UnrealEngine-Angelscript。",
    "start_commit": "61adb70a65b5b9758f1c9de8eaba8b665585d6d0"
  },
  "declared_stage": "implementing",
  "architecture": {
    "path": "Docs/Phase54/P54.0_Execution_Tier_Performance_Architecture.md",
    "version": 2,
    "sha256": "83c5385556abf718e94660c8b026c83d8296b538827b7c02c92400cc28295c5a",
    "revision_reason": "按用户确认将 PC 关键路径改为 Wasmtime Cranelift JIT 对 Puerts V8 JIT；WAMR AOT 后移到 Shipping 与移动端，并加入 JIT 对 JIT 止损 Gate。"
  },
  "documents": {
    "plan": "Docs/Phase54/P54.1_Execution_Tier_Implementation_Plan.md",
    "closeout": "Docs/Phase54/P54_Phase54_Closeout.md"
  },
  "batches": [
    {
      "id": "P54.0",
      "status": "Completed",
      "evidence": "架构 v2、实施计划、中文 closeout 骨架、两项只读审计与流程错误预防规则已写入；基线架构检查通过。",
      "completed_at_utc": "2026-07-26T17:14:49.4622398+00:00"
    },
    {
      "id": "P54.1",
      "status": "Completed",
      "evidence": "backend identity/capability/selection/artifact/factory/instance-owned handle 已实现；UE5.8 VM+Runtime build 通过，VM Automation 12/12、Runtime smoke 1/1，通过独立源码审查；共享暂存区历史问题已记录且不影响实现。",
      "completed_at_utc": "2026-07-26T17:15:00.7777339+00:00"
    },
    {
      "id": "P54.2",
      "status": "Completed",
      "evidence": "Wasmtime v45 Cranelift JIT 后端、依赖锁、动态 import、Runtime 生命周期与 WAMR/Wasmtime 共享 parity lanes 已实现；AvidScriptVM/AvidScriptRuntime no-clean UBT 通过，聚焦 Automation 16/16 通过，独立审查 Accepted。",
      "completed_at_utc": "2026-07-26T20:04:25.6766724+00:00"
    },
    {
      "id": "P54.3",
      "status": "Pending",
      "evidence": "",
      "completed_at_utc": null
    },
    {
      "id": "P54.4",
      "status": "Pending",
      "evidence": "",
      "completed_at_utc": null
    },
    {
      "id": "P54.5",
      "status": "Pending",
      "evidence": "",
      "completed_at_utc": null
    },
    {
      "id": "P54.6",
      "status": "Pending",
      "evidence": "",
      "completed_at_utc": null
    }
  ],
  "debt": [],
  "review": {
    "completed": false,
    "evidence": "",
    "completed_at_utc": null
  },
  "budgets": {
    "ubt": 3,
    "automation": 2,
    "full_gate": 2
  },
  "invocations": {
    "ubt": 0,
    "automation": 0,
    "full_gate": 0
  },
  "freeze": {
    "source_commit": "",
    "source_tree": "",
    "state_sha256": "",
    "review_evidence": "",
    "at_utc": null
  },
  "gate": {
    "report_path": "",
    "report_sha256": "",
    "run_id": "",
    "verified_commit": "",
    "verified_tree": "",
    "attestation_parent": "",
    "attested_at_utc": null
  },
  "protected_dirty": [
    {
      "path": "Docs/AvidScript_Technical_Status.md",
      "status": "??",
      "worktree_sha256": "3025ef2e274d0373168eea28a25bef6bd1a86a19e887d76ee51c6804d51698c2",
      "head_blob_sha256": ""
    },
    {
      "path": "Docs/Phase42/P42.0_Reflection_Binding_Generator_Architecture.md",
      "status": " M",
      "worktree_sha256": "569cf61960108edd6a4865da796ddf465b2ab6e6cf440dc2ae280b84f94d6655",
      "head_blob_sha256": "5881954e78c9759dafb336484adf7dcd9d064122599e9b93337c69067b08c1cf"
    },
    {
      "path": "Source/AvidScriptRuntime/Public/AvidScriptWasmReloadTypes.h",
      "status": " M",
      "worktree_sha256": "384b6e093dc8568e666dc0335b575383e473ecf00448c1d5c461a852b38edfed",
      "head_blob_sha256": "78adf726b93efd9a8736ed8152b9fd9fd293e26d2910e670d738176de0a4af49"
    }
  ],
  "next_action": "batch-complete -Phase 54 -BatchId P54.3 -Evidence <text>",
  "revision": 5,
  "updated_at_utc": "2026-07-26T20:04:25.6789887+00:00"
}
