{
  "schema_version": 1,
  "phase": {
    "id": 53,
    "goal": "建立 Puerts V8 与 AvidScript 在 UE5.8 Win64 的同机四路可复现性能基准，完成至少一轮通用热路径优化并公开分项结果",
    "start_commit": "a1cf61416ad1d28ac07e92da9626b54f2604b31e"
  },
  "declared_stage": "implementing",
  "architecture": {
    "path": "Docs/Phase53/P53.0_Puerts_Performance_Comparison_Architecture.md",
    "version": 2,
    "sha256": "9be4255b59c40be5083d6ef729b5721820a9570486fdbb2347455d4d14caef56",
    "revision_reason": "正式校准证明共享迭代数由最快 lane 放大慢 lane 到不可执行时长；改为 workload x lane 独立校准并只比较归一化 ns/op。"
  },
  "documents": {
    "plan": "Docs/Phase53/P53.1_Puerts_Performance_Comparison_Implementation_Plan.md",
    "closeout": "Docs/Phase53/P53_Phase53_Closeout.md"
  },
  "batches": [
    {
      "id": "P53.1",
      "status": "Completed",
      "evidence": "Puerts lock/marker Verify passed; dependency contracts parser/schema/tamper rejection passed; architecture isolation passed; UE5.8 compiled and linked JsEnv plus AvidScriptPerfHarness with no-clean UBT, final incremental Result Succeeded in 9.11s; Chinese compatibility record added.",
      "completed_at_utc": "2026-07-26T05:42:29.4939850+00:00"
    },
    {
      "id": "P53.2",
      "status": "Completed",
      "evidence": "四通道 Harness 已完成：Native C++、Puerts V8 Reflection、Puerts V8 Static、AvidScript C# 到 WAMR 共用同一 Actor fixture 与 7 类工作负载；固定 seed 的 checksum、最终状态、operation count 和 AvidScript Host import count全部一致。Guest 回归 68/68、no-clean UE5.8 Editor 增量构建成功、focused Automation Correctness 成功；结果 schema、缺失 lane、重复样本与 checksum 篡改拒绝合同通过；生产模块与 Puerts 隔离合同通过。",
      "completed_at_utc": "2026-07-26T07:29:45.3319423+00:00"
    },
    {
      "id": "P53.3",
      "status": "Completed",
      "evidence": "正式 warm baseline 完成：AvidScript commit 1ab9c4c81780、Puerts 1977328c8466、UE5.8 Win64 Development Editor；独立 lane 校准，1 calibration + 5 fresh timed processes，5 warmup + 30 timed samples，6,000/6,000 正确；aggregate attempt c7c7209e-f1ec-4ff9-9d06-5fa1a054a90f。P50 几何平均 Avid/Puerts Reflection=6.99x、Avid/Puerts Static=11.82x；中文报告 P53.3_Puerts_Warm_Baseline_Report.md 已记录。",
      "completed_at_utc": "2026-07-26T10:31:48.4499601+00:00"
    },
    {
      "id": "P53.4",
      "status": "Completed",
      "evidence": "通用热路径优化完成：commit 2ce7a9b41e7b 取消成功 handle resolve 的 UObject path materialization，不改变 generation、stale handle、IsA、ownership 或失败诊断；干净候选 UE5.8 UBT 编译链接 AvidScriptBindings 与 AvidScriptPerfHarness，focused Automation AvidScript.PerformanceComparison.FourLane.Correctness 通过；正式 attempt 28c5857c-1149-4c29-aa42-b390e0697f43 为 1 calibration + 5 fresh timed processes、5 warmup + 30 timed，6,000/6,000 样本正确。UObject crossing workload 提升 20.2%-34.9%，Avid/Puerts Reflection 几何平均由 6.99x 降至 5.73x；生产 hot-path 静态合同通过。",
      "completed_at_utc": "2026-07-26T11:21:54.0112267+00:00"
    },
    {
      "id": "P53.5",
      "status": "Completed",
      "evidence": "独立复审 Critical=0、Important=0；正式 benchmark 12000/12000；完整 Automation 277/277；隐私扫描发现的用户绝对路径已改为环境变量，隔离工程 junction 入口规则已记录。",
      "completed_at_utc": "2026-07-26T15:50:51.0017709+00:00"
    }
  ],
  "debt": [
    {
      "id": "P53-COLD-RSS-LANE-ISOLATION",
      "severity": "Normal",
      "found_batch": "P53.5",
      "scope": "为 AvidScript/WAMR、Puerts Reflection、Puerts Static 分别采集 lane 隔离的冷启动时间、稳定 RSS 与峰值 RSS；当前四 lane 同进程数据只能表示组合 Editor 包络。",
      "evidence": "正式 attempt 28c5857c-1149-4c29-aa42-b390e0697f43 的 fresh process wall time 为 24.46-25.11 秒、PeakPhysMemoryMB 为 1599-1602，但同时加载 UE、Puerts/V8、AvidScript/WAMR 与 Harness，不能归因到单一框架。",
      "deferral_reason": "lane 隔离需要改变启动配置、结果 schema 与 runner 生命周期，并重新生成独立 baseline；把它塞入 warm 优化收口会混合实验口径并迫使已完成的同机矩阵失效。",
      "remediation": "在下一性能执行层 Phase 增加 lane-exclusive process mode、startup milestones、稳定采样窗口、peak RSS 和 unload policy，再以固定 manifest 生成独立 cold/memory 报告。",
      "status": "Transferred",
      "resolution_evidence": "P53 warm 排名不使用组合进程的 cold/RSS 数字；P53.4 报告已明确其不可归因边界。",
      "target_phase": 54,
      "transfer_reason": "Phase 54 进入 VM 执行层与 generated thunk 性能路线时，需要同时建立 lane-exclusive cold/RSS 基线；与 interpreter/AOT/JIT 分层一起设计可避免再次改写 schema 和启动编排。"
    }
  ],
  "review": {
    "completed": false,
    "evidence": "reopened: 最终隐私门禁发现 AGENTS 含本机用户目录；改为环境变量路径，并记录隔离工程 junction 入口要求后重新签发 Gate。",
    "completed_at_utc": null
  },
  "budgets": {
    "ubt": 3,
    "automation": 2,
    "full_gate": 2
  },
  "invocations": {
    "ubt": 1,
    "automation": 2,
    "full_gate": 1
  },
  "freeze": {
    "source_commit": "",
    "source_tree": "",
    "state_sha256": "",
    "review_evidence": "",
    "at_utc": null
  },
  "gate": {
    "report_path": "",
    "report_sha256": "",
    "run_id": "",
    "verified_commit": "",
    "verified_tree": "",
    "attestation_parent": "",
    "attested_at_utc": null
  },
  "protected_dirty": [],
  "next_action": "freeze -Phase 53 -ReviewEvidence <text>",
  "revision": 37,
  "updated_at_utc": "2026-07-26T15:50:51.0046238+00:00"
}
