{
  "schema_version": 1,
  "phase": {
    "id": 52,
    "goal": "建立 descriptor v8 驱动、显式授权、缓存执行并支持 candidate reload 回滚的 C# 双向 reflected property Binding 闭环",
    "start_commit": "474607b4a92031a19f9a38f6b38e6a1d0ddc39d4"
  },
  "declared_stage": "implementing",
  "architecture": {
    "path": "Docs/Phase52/P52.0_Bidirectional_Property_Binding_Architecture.md",
    "version": 1,
    "sha256": "7557fdfa7e6e7c05812b5659b582a2ca530b06d7fb812c7b53d14058acb47532",
    "revision_reason": "initial architecture freeze"
  },
  "documents": {
    "plan": "Docs/Phase52/P52.1_Bidirectional_Property_Binding_Implementation_Plan.md",
    "closeout": "Docs/Phase52/P52_Phase52_Closeout.md"
  },
  "batches": [
    {
      "id": "P52.1",
      "status": "Completed",
      "evidence": "schema 8、显式 writable selection 与编辑器写策略已由提交 1d50f39 实现",
      "completed_at_utc": "2026-07-25T17:56:21.8123185+00:00"
    },
    {
      "id": "P52.2",
      "status": "Completed",
      "evidence": "生成器自然属性配对、稳定 property_set 身份与 C# ABI lowering 已由提交 1d50f39 实现",
      "completed_at_utc": "2026-07-25T17:56:22.9328604+00:00"
    },
    {
      "id": "P52.3",
      "status": "Completed",
      "evidence": "缓存运行时写计划、候选事务属性快照与逆序回滚已由提交 1d50f39 实现",
      "completed_at_utc": "2026-07-25T17:56:24.0478807+00:00"
    },
    {
      "id": "P52.4",
      "status": "Completed",
      "evidence": "提交 32bcb21 与修复 5336366 完成中文版 BeginPlay/Tick C# 样例、真实 C# property assignment lowering、scalar/struct 路径、BlueprintSetter、candidate commit/trap rollback/旧 runtime 延续；Guest 62/62 与 focused UE Automation 5/5 通过；setter benchmark native P50/P95 0.000000196/0.000000393 ms，binding 0.000190041/0.000193359 ms，WAMR 0.000931446/0.000948632 ms，11776 次调用均为单 crossing，warm class/name lookup 与 snapshot capture 均为 0",
      "completed_at_utc": "2026-07-25T18:21:40.1841387+00:00"
    },
    {
      "id": "P52.5",
      "status": "Pending",
      "evidence": "",
      "completed_at_utc": null
    }
  ],
  "debt": [
    {
      "id": "P52-REVIEW-01",
      "severity": "Important",
      "found_batch": "P52.5",
      "scope": "独立复审发现 C# property lvalue 求值顺序、legacy profile identity、BlueprintSetter descriptor identity、object snapshot GC root、accessor-level provenance、benchmark anti-optimization 与真实样例闭环缺口",
      "evidence": "独立只读审查快照 6a9c905：1 High、5 Medium，并确认 BidirectionalProperties 样例尚未进入同一 profile build/WASM/UE 证据链",
      "deferral_reason": "在 P52.5 集中修复批次统一处理，避免每个审查项各自触发 UBT 与 Automation",
      "remediation": "修复六项生产合同；增加 legacy identity、求值顺序、精确 accessor、GC rollback、anti-fold benchmark 与真实样例 profile gameplay 回归；受影响 focused 通过后只执行一次最终全量 Gate",
      "status": "Open",
      "resolution_evidence": "",
      "target_phase": null,
      "transfer_reason": ""
    }
  ],
  "review": {
    "completed": false,
    "evidence": "",
    "completed_at_utc": null
  },
  "budgets": {
    "ubt": 3,
    "automation": 2,
    "full_gate": 2
  },
  "invocations": {
    "ubt": 0,
    "automation": 0,
    "full_gate": 0
  },
  "freeze": {
    "source_commit": "",
    "source_tree": "",
    "state_sha256": "",
    "review_evidence": "",
    "at_utc": null
  },
  "gate": {
    "report_path": "",
    "report_sha256": "",
    "run_id": "",
    "verified_commit": "",
    "verified_tree": "",
    "attestation_parent": "",
    "attested_at_utc": null
  },
  "protected_dirty": [
    {
      "path": "Docs/AvidScript_Technical_Status.md",
      "status": "??",
      "worktree_sha256": "3025ef2e274d0373168eea28a25bef6bd1a86a19e887d76ee51c6804d51698c2",
      "head_blob_sha256": ""
    },
    {
      "path": "Docs/Phase42/P42.0_Reflection_Binding_Generator_Architecture.md",
      "status": " M",
      "worktree_sha256": "569cf61960108edd6a4865da796ddf465b2ab6e6cf440dc2ae280b84f94d6655",
      "head_blob_sha256": "5881954e78c9759dafb336484adf7dcd9d064122599e9b93337c69067b08c1cf"
    },
    {
      "path": "Source/AvidScriptRuntime/Public/AvidScriptWasmReloadTypes.h",
      "status": " M",
      "worktree_sha256": "384b6e093dc8568e666dc0335b575383e473ecf00448c1d5c461a852b38edfed",
      "head_blob_sha256": "78adf726b93efd9a8736ed8152b9fd9fd293e26d2910e670d738176de0a4af49"
    }
  ],
  "next_action": "batch-complete -Phase 52 -BatchId P52.5 -Evidence <text>",
  "revision": 6,
  "updated_at_utc": "2026-07-25T18:55:39.2959788+00:00"
}
