{
  "schema_version": 1,
  "phase": {
    "id": 55,
    "goal": "预绑定 Generated S1 host call cell，拆分 int32 property ABI，并以 verified Wasmtime unchecked export 压缩 scalar、property 与 callback 固定成本。",
    "start_commit": "0ce89860f95477726e8e141f05fbf73b85311d5f"
  },
  "declared_stage": "gate_attested",
  "architecture": {
    "path": "Docs/Phase55/P55.0_Bound_Crossing_Architecture.md",
    "version": 2,
    "sha256": "08b6c4f74d710d7a59476ac7c07f266e5b34e014b48a24f34c745868c3d30d2a",
    "revision_reason": "Independent review identified UE-to-WASM callback result materialization and export-name conversion as separate hot costs; architecture now includes prebound exports and failure-only success outcomes while preserving full diagnostics on failure."
  },
  "documents": {
    "plan": "Docs/Phase55/P55.0_Bound_Crossing_Implementation_Plan.md",
    "closeout": "Docs/Phase55/P55_Phase55_Closeout.md"
  },
  "batches": [
    {
      "id": "P55.0",
      "status": "Completed",
      "evidence": "Architecture and implementation plan committed at 4531793; strict best-Puerts P50/P95/MAD gates, split property ABI, prepared call-cell lifecycle and unchecked export safety are frozen.",
      "completed_at_utc": "2026-07-28T17:21:18.6692938+00:00"
    },
    {
      "id": "P55.1",
      "status": "Completed",
      "evidence": "prepared host call cell、对象注册表 revision、revision-aware Self 缓存与 Tick FailureOnly 结果策略已实现；UE5.8 no-clean 构建及相关 Automation 已通过。",
      "completed_at_utc": "2026-07-28T20:08:28.8067858+00:00"
    },
    {
      "id": "P55.2",
      "status": "Completed",
      "evidence": "split int32 getter/setter ABI、shape-driven 生成桥接和 Data-Oriented split setter 已实现；semantic、generated S1、data-oriented 三个真实 C# profile 加载与正确性通过。",
      "completed_at_utc": "2026-07-28T20:08:42.1978718+00:00"
    },
    {
      "id": "P55.3",
      "status": "Completed",
      "evidence": "Wasmtime lifecycle export 已在加载期验证并通过 unchecked typed call 执行；BeginPlay、Tick、EndPlay 共用静态导出名与分级结果详情，成功热路径减少快照复制且失败诊断完整。",
      "completed_at_utc": "2026-07-28T20:08:57.9487720+00:00"
    },
    {
      "id": "P55.4",
      "status": "Completed",
      "evidence": "干净候选 b858a01 架构检查通过；UE5.8 no-clean 构建、Automation 312/312、三 profile、controlled runtime、physical crossing、micro 与 gameplay 正式矩阵全部通过正确性与 provenance。12 项性能 Gate 通过 3 项，完整结果已发布为中文报告与 compact evidence。",
      "completed_at_utc": "2026-07-28T20:09:06.0114776+00:00"
    }
  ],
  "debt": [
    {
      "id": "P55-D01",
      "severity": "Important",
      "found_batch": "P55.4",
      "scope": "Generated S1 scalar、property 与 lifecycle callback 的完整 bound crossing 固定成本",
      "evidence": "正式 Gate：scalar 52.95 ns 且为 Puerts Static 1.67x；property 104.75 ns；callback 212.23 ns 且为 Puerts 最快对照 1.45x。",
      "deferral_reason": "Phase 55 已完成预绑定单元与 ABI 拆分，剩余成本需要跨 receiver、参数区、返回区、scheduler 和 backend 的融合调用帧，属于下一阶段架构范围。",
      "remediation": "Phase 56 实现生成式 fused call frame、prepared receiver direct slot、reload slow path 分层与 lifecycle direct/batch entry，并按绝对 ns 与 Puerts 最快路径双 Gate 验收。",
      "status": "Transferred",
      "resolution_evidence": "Phase 55 compact evidence 已固定当前候选、正式数值与失败 Gate，Phase 56 不得回退语义覆盖或逐个手写 UE API。",
      "target_phase": 56,
      "transfer_reason": "需要以新一阶段的融合调用帧架构统一修改 VM、Bindings、Runtime 与 lifecycle 调度，并重新运行正式 competitor matrix。"
    },
    {
      "id": "P55-D02",
      "severity": "Important",
      "found_batch": "P55.4",
      "scope": "Wasmtime Cranelift JIT 的相同 WASM P95 领先与完整 crossing 成本归因",
      "evidence": "正式 Gate：Wasmtime/V8 P95 几何均值 1.0108、P95 kernel win rate 0.50；typed empty 只能解释完整 crossing 成本 0.1995。",
      "deferral_reason": "执行层 P50 已接近 V8，剩余问题涉及 Cranelift 配置、fuel/epoch/guard、线程调度及完整帧成本分解，需要独立 profiling 与受控实验。",
      "remediation": "Phase 56 对 backend 配置与 tail latency 做逐项消融，加入完整 call frame 分段计数，并以 P95 几何均值不高于 0.95、kernel win rate 不低于 0.60 验收。",
      "status": "Transferred",
      "resolution_evidence": "Phase 55 已保存 controlled suite 与 physical crossing SHA-256、候选身份和失败门槛，作为 Phase 56 的可复现基线。",
      "target_phase": 56,
      "transfer_reason": "需要新的 backend 配置消融、tail profiling 和 call-frame 分段证据，不能在 Phase 55 已冻结的正式样本后用猜测调参。"
    }
  ],
  "review": {
    "completed": true,
    "evidence": "集中复审确认：干净候选架构检查通过；ABI 所有消费者已覆盖；UE5.8 no-clean 构建、312/312 Automation、三 C# profile 和四组正式 benchmark 正确性通过；性能未达项已作为 P55-D01/P55-D02 转交 Phase 56。",
    "completed_at_utc": "2026-07-28T20:12:57.4435854+00:00"
  },
  "budgets": {
    "ubt": 2,
    "automation": 2,
    "full_gate": 2
  },
  "invocations": {
    "ubt": 1,
    "automation": 1,
    "full_gate": 1
  },
  "freeze": {
    "source_commit": "d9da5c3000ac61a8eaed04a34684ecf5091f3c68",
    "source_tree": "353b5d47d5c3e84c88e5ea0866982d8d774147d8",
    "state_sha256": "ecdc9e5f7a4acf858cc81ed2bdb1f1e22048b6868e57003d80272781f14c5845",
    "review_evidence": "集中复审确认：干净候选架构检查通过；ABI 所有消费者已覆盖；UE5.8 no-clean 构建、312/312 Automation、三 C# profile 和四组正式 benchmark 正确性通过；性能未达项已作为 P55-D01/P55-D02 转交 Phase 56。",
    "at_utc": "2026-07-28T20:12:57.4435854+00:00"
  },
  "gate": {
    "report_path": "C:\\tmp\\AvidScriptPhase55Gate-51b39ab\\Phase55_Gate.json",
    "report_sha256": "a975787f3350e5d57eb6d64394fef6d3aeb468eeb6975f371407373f0fcaf53f",
    "run_id": "phase55-final-51b39ab",
    "verified_commit": "51b39ab935171349faf96982b5f9c8d0bf706e34",
    "verified_tree": "ae033a096aed542fdaa6385c0b9588871043d9d0",
    "attestation_parent": "51b39ab935171349faf96982b5f9c8d0bf706e34",
    "attested_at_utc": "2026-07-28T20:25:13.6700968+00:00"
  },
  "protected_dirty": [
    {
      "path": "Docs/AvidScript_Technical_Status.md",
      "status": "??",
      "worktree_sha256": "3025ef2e274d0373168eea28a25bef6bd1a86a19e887d76ee51c6804d51698c2",
      "head_blob_sha256": ""
    },
    {
      "path": "Docs/Phase42/P42.0_Reflection_Binding_Generator_Architecture.md",
      "status": " M",
      "worktree_sha256": "569cf61960108edd6a4865da796ddf465b2ab6e6cf440dc2ae280b84f94d6655",
      "head_blob_sha256": "5881954e78c9759dafb336484adf7dcd9d064122599e9b93337c69067b08c1cf"
    },
    {
      "path": "Source/AvidScriptRuntime/Public/AvidScriptWasmReloadTypes.h",
      "status": " M",
      "worktree_sha256": "384b6e093dc8568e666dc0335b575383e473ecf00448c1d5c461a852b38edfed",
      "head_blob_sha256": "78adf726b93efd9a8736ed8152b9fd9fd293e26d2910e670d738176de0a4af49"
    }
  ],
  "next_action": "close -Phase 55",
  "revision": 14,
  "updated_at_utc": "2026-07-28T20:25:13.6724279+00:00"
}
